{
  "schema": 5,
  "plugin": "golang",
  "skill": "go-docs",
  "models": {
    "anthropic/claude-haiku-4-5": {
      "triggers": {
        "provider": "anthropic",
        "model": "claude-haiku-4-5",
        "display": "Claude Haiku 4.5",
        "tool_version": "v0.2.1-37-g57b4712-dirty",
        "ran_at": "2026-06-21T13:46:13Z",
        "executed": true,
        "content_hash": "a1e2d73405336dfc12e64a56ca3b24e0ddc9010d2d5c91f52db3e2de05b9748f",
        "runs_per_query": 3,
        "timeout_seconds": 120,
        "pricing": {
          "input_per_mtok": 1,
          "output_per_mtok": 5
        },
        "results": [
          {
            "query": "Add doc comments to the exported functions in this Go package",
            "should_trigger": true,
            "hits": 0,
            "runs": 3,
            "passed": false,
            "avg_run_seconds": 7.2,
            "estimate": {
              "input_tokens": 1029,
              "input_cost_usd": 0.001029
            },
            "spec_hash": "fd98ae88ad3a25f3fdf34c5e8ca0323cca089e6038e1a2c6d0cb49e2db891be8"
          },
          {
            "query": "Write a package comment for internal/clientmap",
            "should_trigger": true,
            "hits": 0,
            "runs": 3,
            "passed": false,
            "avg_run_seconds": 10,
            "estimate": {
              "input_tokens": 1027,
              "input_cost_usd": 0.001027
            },
            "spec_hash": "bcab40145d7e8ef9d8fed39ebc78f7c5279fbbc0ee252571c6eb986f87ebfcb2"
          },
          {
            "query": "Should the package comment go in doc.go or at the top of an existing file?",
            "should_trigger": true,
            "hits": 2,
            "runs": 3,
            "passed": true,
            "avg_run_seconds": 9.6,
            "estimate": {
              "input_tokens": 1036,
              "input_cost_usd": 0.001036
            },
            "spec_hash": "fe70ba0cd52aa9919c1a91dcb245f0a615480a4f2ea52d020df4526a7b5aa763"
          },
          {
            "query": "Document the exported API of this Go module",
            "should_trigger": true,
            "hits": 0,
            "runs": 3,
            "passed": false,
            "avg_run_seconds": 7.8,
            "estimate": {
              "input_tokens": 1026,
              "input_cost_usd": 0.001026
            },
            "spec_hash": "8439aeb29e0aa8e97007e2d2fced2d629f2f76b3ff1b1bc45e5ae4aad11f36b7"
          },
          {
            "query": "Generate markdown CLI docs for my cobra tool",
            "should_trigger": true,
            "hits": 0,
            "runs": 3,
            "passed": false,
            "avg_run_seconds": 11,
            "estimate": {
              "input_tokens": 1026,
              "input_cost_usd": 0.001026
            },
            "spec_hash": "e728f225b099fa6af63f008ec0ad69f86aa7829a8045f5100ceb1bf6e69967e5"
          },
          {
            "query": "Make my Go CLI's documentation consumable by LLMs",
            "should_trigger": true,
            "hits": 0,
            "runs": 3,
            "passed": false,
            "avg_run_seconds": 8.6,
            "estimate": {
              "input_tokens": 1030,
              "input_cost_usd": 0.00103
            },
            "spec_hash": "77cd4d8062f28fa57058dbdbca85ab734c6a09c4121eaca35063e0f5428f6d3e"
          },
          {
            "query": "Review this Go package for missing godoc comments",
            "should_trigger": true,
            "hits": 0,
            "runs": 3,
            "passed": false,
            "avg_run_seconds": 7.3,
            "estimate": {
              "input_tokens": 1027,
              "input_cost_usd": 0.001027
            },
            "spec_hash": "f52908ad0cc1857a7f97db483c75239b324f9d8b9f54145cb4ff2328f7b61dd2"
          },
          {
            "query": "Add a doc.go to this package",
            "should_trigger": true,
            "hits": 0,
            "runs": 3,
            "passed": false,
            "avg_run_seconds": 7,
            "estimate": {
              "input_tokens": 1026,
              "input_cost_usd": 0.001026
            },
            "spec_hash": "334c2e07db702839b14329a28522b2e3f403a4529ee419e259257dff9851577b"
          },
          {
            "query": "Write a README for this Go project",
            "should_trigger": false,
            "hits": 0,
            "runs": 3,
            "passed": true,
            "avg_run_seconds": 7.5,
            "estimate": {
              "input_tokens": 1025,
              "input_cost_usd": 0.001025
            },
            "spec_hash": "756a0cc1e508c485eba577154206471f1b69bf2c12460ae419ef875d90e13b81"
          },
          {
            "query": "Add inline comments explaining how this Go algorithm works",
            "should_trigger": false,
            "hits": 0,
            "runs": 3,
            "passed": true,
            "avg_run_seconds": 4.2,
            "estimate": {
              "input_tokens": 1027,
              "input_cost_usd": 0.001027
            },
            "spec_hash": "b5cfd1dd46772595323f8d48ce6d6884d7e25885ad81fdf5cd53e210cb9cda30"
          },
          {
            "query": "Write table-driven tests for this Go function",
            "should_trigger": false,
            "hits": 0,
            "runs": 3,
            "passed": true,
            "avg_run_seconds": 3.3,
            "estimate": {
              "input_tokens": 1027,
              "input_cost_usd": 0.001027
            },
            "spec_hash": "75eb0dbf254924451b3ba9562e2d05c52624dc6eeb199474803d2bfe8fb6b39c"
          },
          {
            "query": "Scaffold a new Go service with cmd and internal layout",
            "should_trigger": false,
            "hits": 0,
            "runs": 3,
            "passed": true,
            "avg_run_seconds": 10.8,
            "estimate": {
              "input_tokens": 1029,
              "input_cost_usd": 0.001029
            },
            "spec_hash": "9eef8ddfa03d8db7007e8bb19541b1d9aea21ebc47de4382be746f6c295d7ab7"
          },
          {
            "query": "Add docstrings to this Python module",
            "should_trigger": false,
            "hits": 0,
            "runs": 3,
            "passed": true,
            "avg_run_seconds": 4.7,
            "estimate": {
              "input_tokens": 1026,
              "input_cost_usd": 0.001026
            },
            "spec_hash": "45e3584d3534540db1bd7416654885916a01f1587f63152a0dfc4c42d29610a9"
          },
          {
            "query": "Generate OpenAPI docs for my Go REST API",
            "should_trigger": false,
            "hits": 0,
            "runs": 3,
            "passed": true,
            "avg_run_seconds": 6.9,
            "estimate": {
              "input_tokens": 1027,
              "input_cost_usd": 0.001027
            },
            "spec_hash": "4f1002296f70d5bc4826434469e7cbd686caa1a207f72c381c028ae54a2e0052"
          }
        ],
        "summary": {
          "passed": 7,
          "failed": 7,
          "total": 14,
          "pass_rate": 0.5,
          "avg_run_seconds": 7.6,
          "estimate": {
            "input_tokens": 14388,
            "input_cost_usd": 0.014388
          }
        },
        "previous": {
          "ran_at": "2026-06-21T03:34:59Z",
          "summary": {
            "passed": 7,
            "failed": 7,
            "total": 14,
            "pass_rate": 0.5,
            "avg_run_seconds": 7.1,
            "estimate": {
              "input_tokens": 14388,
              "input_cost_usd": 0.014388
            }
          },
          "results": [
            {
              "query": "Add a doc.go to this package",
              "should_trigger": false,
              "hits": 0,
              "runs": 3,
              "passed": false,
              "avg_run_seconds": 6.4,
              "estimate": {
                "input_tokens": 1026,
                "input_cost_usd": 0.001026
              }
            },
            {
              "query": "Add doc comments to the exported functions in this Go package",
              "should_trigger": false,
              "hits": 0,
              "runs": 3,
              "passed": false,
              "avg_run_seconds": 5,
              "estimate": {
                "input_tokens": 1029,
                "input_cost_usd": 0.001029
              }
            },
            {
              "query": "Add docstrings to this Python module",
              "should_trigger": false,
              "hits": 0,
              "runs": 3,
              "passed": true,
              "avg_run_seconds": 4.9,
              "estimate": {
                "input_tokens": 1026,
                "input_cost_usd": 0.001026
              }
            },
            {
              "query": "Add inline comments explaining how this Go algorithm works",
              "should_trigger": false,
              "hits": 0,
              "runs": 3,
              "passed": true,
              "avg_run_seconds": 4.2,
              "estimate": {
                "input_tokens": 1027,
                "input_cost_usd": 0.001027
              }
            },
            {
              "query": "Document the exported API of this Go module",
              "should_trigger": false,
              "hits": 0,
              "runs": 3,
              "passed": false,
              "avg_run_seconds": 10,
              "estimate": {
                "input_tokens": 1026,
                "input_cost_usd": 0.001026
              }
            },
            {
              "query": "Generate OpenAPI docs for my Go REST API",
              "should_trigger": false,
              "hits": 0,
              "runs": 3,
              "passed": true,
              "avg_run_seconds": 8,
              "estimate": {
                "input_tokens": 1027,
                "input_cost_usd": 0.001027
              }
            },
            {